{
  "projectName": "my-cli",
  "description": "A TypeScript CLI tool",
  "projectType": "cli-tool",
  "language": "typescript",
  "modelCapability": "capable",
  "domainComplexity": "single-domain",
  "aiRuntime": "none",
  "database": "none",
  "auth": "none",
  "deployment": "none",
  "ci": "local",
  "openSource": true,
  "multiTenant": false,
  "preserveResearchData": true,
  "packageManager": "pnpm",
  "toolAliases": [],
  "deferredDecisions": []
}
