{
  "projectName": "my-ai-runtime",
  "description": "A TypeScript AI orchestration runtime",
  "projectType": "monorepo",
  "language": "typescript",
  "modelCapability": "capable",
  "domainComplexity": "multi-domain",
  "aiRuntime": "mastra",
  "database": "postgresql",
  "auth": "none",
  "deployment": "docker",
  "ci": "local",
  "openSource": false,
  "multiTenant": false,
  "preserveResearchData": true,
  "packageManager": "pnpm",
  "toolAliases": [],
  "deferredDecisions": []
}
