{
  "projectName": "my-backend",
  "description": "A TypeScript backend service",
  "projectType": "single-app",
  "language": "typescript",
  "modelCapability": "capable",
  "domainComplexity": "multi-domain",
  "aiRuntime": "none",
  "database": "postgresql",
  "auth": "none",
  "deployment": "docker",
  "ci": "local",
  "openSource": false,
  "multiTenant": false,
  "preserveResearchData": true,
  "packageManager": "pnpm",
  "toolAliases": [],
  "deferredDecisions": []
}
